{
  "version": "1.0.0",
  "metadata": {
    "id": "test-level",
    "name": "Test Level",
    "author": "GeoRhythm",
    "description": "A simple test level to verify game mechanics",
    "difficulty": "easy",
    "songId": 1,
    "songName": "Test Song",
    "songArtist": "GeoRhythm",
    "duration": 60
  },
  "settings": {
    "backgroundColor": "#0066FF",
    "groundColor": "#0044AA",
    "lineColor": "#0077DD",
    "startMode": "cube",
    "startSpeed": "normal",
    "startGravity": "normal",
    "groundY": 12
  },
  "objects": [
    { "type": "block", "x": 0, "y": 12 },
    { "type": "block", "x": 1, "y": 12 },
    { "type": "block", "x": 2, "y": 12 },
    { "type": "block", "x": 3, "y": 12 },
    { "type": "block", "x": 4, "y": 12 },
    { "type": "block", "x": 5, "y": 12 },
    { "type": "block", "x": 6, "y": 12 },
    { "type": "block", "x": 7, "y": 12 },
    { "type": "block", "x": 8, "y": 12 },
    { "type": "block", "x": 9, "y": 12 },
    { "type": "block", "x": 10, "y": 12 },
    { "type": "block", "x": 11, "y": 12 },
    { "type": "block", "x": 12, "y": 12 },
    { "type": "block", "x": 13, "y": 12 },
    { "type": "block", "x": 14, "y": 12 },
    { "type": "block", "x": 15, "y": 12 },
    { "type": "block", "x": 16, "y": 12 },
    { "type": "block", "x": 17, "y": 12 },
    { "type": "block", "x": 18, "y": 12 },
    { "type": "block", "x": 19, "y": 12 },
    { "type": "block", "x": 20, "y": 12 },
    { "type": "block", "x": 21, "y": 12 },
    { "type": "block", "x": 22, "y": 12 },
    { "type": "block", "x": 23, "y": 12 },
    { "type": "block", "x": 24, "y": 12 },
    { "type": "block", "x": 25, "y": 12 },
    { "type": "block", "x": 26, "y": 12 },
    { "type": "block", "x": 27, "y": 12 },
    { "type": "block", "x": 28, "y": 12 },
    { "type": "block", "x": 29, "y": 12 },
    { "type": "block", "x": 30, "y": 12 },
    { "type": "block", "x": 31, "y": 12 },
    { "type": "block", "x": 32, "y": 12 },
    { "type": "block", "x": 33, "y": 12 },
    { "type": "block", "x": 34, "y": 12 },
    { "type": "block", "x": 35, "y": 12 },
    { "type": "block", "x": 36, "y": 12 },
    { "type": "block", "x": 37, "y": 12 },
    { "type": "block", "x": 38, "y": 12 },
    { "type": "block", "x": 39, "y": 12 },
    { "type": "block", "x": 40, "y": 12 },
    { "type": "block", "x": 41, "y": 12 },
    { "type": "block", "x": 42, "y": 12 },
    { "type": "block", "x": 43, "y": 12 },
    { "type": "block", "x": 44, "y": 12 },
    { "type": "block", "x": 45, "y": 12 },
    { "type": "block", "x": 46, "y": 12 },
    { "type": "block", "x": 47, "y": 12 },
    { "type": "block", "x": 48, "y": 12 },
    { "type": "block", "x": 49, "y": 12 },
    { "type": "block", "x": 50, "y": 12 },
    { "type": "block", "x": 51, "y": 12 },
    { "type": "block", "x": 52, "y": 12 },
    { "type": "block", "x": 53, "y": 12 },
    { "type": "block", "x": 54, "y": 12 },
    { "type": "block", "x": 55, "y": 12 },
    { "type": "block", "x": 56, "y": 12 },
    { "type": "block", "x": 57, "y": 12 },
    { "type": "block", "x": 58, "y": 12 },
    { "type": "block", "x": 59, "y": 12 },
    { "type": "block", "x": 60, "y": 12 },
    { "type": "block", "x": 61, "y": 12 },
    { "type": "block", "x": 62, "y": 12 },
    { "type": "block", "x": 63, "y": 12 },
    { "type": "block", "x": 64, "y": 12 },
    { "type": "block", "x": 65, "y": 12 },
    { "type": "block", "x": 66, "y": 12 },
    { "type": "block", "x": 67, "y": 12 },
    { "type": "block", "x": 68, "y": 12 },
    { "type": "block", "x": 69, "y": 12 },
    { "type": "block", "x": 70, "y": 12 },
    { "type": "block", "x": 71, "y": 12 },
    { "type": "block", "x": 72, "y": 12 },
    { "type": "block", "x": 73, "y": 12 },
    { "type": "block", "x": 74, "y": 12 },
    { "type": "block", "x": 75, "y": 12 },
    { "type": "block", "x": 76, "y": 12 },
    { "type": "block", "x": 77, "y": 12 },
    { "type": "block", "x": 78, "y": 12 },
    { "type": "block", "x": 79, "y": 12 },
    { "type": "block", "x": 80, "y": 12 },
    { "type": "block", "x": 81, "y": 12 },
    { "type": "block", "x": 82, "y": 12 },
    { "type": "block", "x": 83, "y": 12 },
    { "type": "block", "x": 84, "y": 12 },
    { "type": "block", "x": 85, "y": 12 },
    { "type": "block", "x": 86, "y": 12 },
    { "type": "block", "x": 87, "y": 12 },
    { "type": "block", "x": 88, "y": 12 },
    { "type": "block", "x": 89, "y": 12 },
    { "type": "block", "x": 90, "y": 12 },
    { "type": "block", "x": 91, "y": 12 },
    { "type": "block", "x": 92, "y": 12 },
    { "type": "block", "x": 93, "y": 12 },
    { "type": "block", "x": 94, "y": 12 },
    { "type": "block", "x": 95, "y": 12 },
    { "type": "block", "x": 96, "y": 12 },
    { "type": "block", "x": 97, "y": 12 },
    { "type": "block", "x": 98, "y": 12 },
    { "type": "block", "x": 99, "y": 12 },

    { "type": "spike", "x": 8, "y": 11, "id": 101 },

    { "type": "block", "x": 12, "y": 10, "id": 102 },
    { "type": "block", "x": 13, "y": 10, "id": 103 },

    { "type": "spike", "x": 16, "y": 11, "id": 104 },
    { "type": "spike", "x": 17, "y": 11, "id": 105 },

    { "type": "block", "x": 22, "y": 11, "id": 106 },
    { "type": "block", "x": 23, "y": 10, "id": 107 },
    { "type": "block", "x": 24, "y": 9, "id": 108 },
    { "type": "spike", "x": 25, "y": 8, "id": 109 },

    { "type": "spike", "x": 30, "y": 11, "id": 110 },
    { "type": "spike", "x": 31, "y": 11, "id": 111 },
    { "type": "spike", "x": 32, "y": 11, "id": 112 },

    { "type": "block", "x": 38, "y": 11, "id": 113 },
    { "type": "block", "x": 38, "y": 10, "id": 114 },
    { "type": "block", "x": 38, "y": 9, "id": 115 },
    { "type": "spike", "x": 39, "y": 11, "id": 116 },

    { "type": "spike", "x": 45, "y": 11, "id": 117 },
    { "type": "spike", "x": 46, "y": 11, "id": 118 },
    { "type": "spike", "x": 47, "y": 11, "id": 119 },

    { "type": "block", "x": 52, "y": 9, "id": 120 },
    { "type": "block", "x": 53, "y": 9, "id": 121 },
    { "type": "block", "x": 54, "y": 9, "id": 122 },
    { "type": "spike", "x": 53, "y": 8, "id": 123 },

    { "type": "spike", "x": 60, "y": 11, "id": 124 },

    { "type": "block", "x": 64, "y": 10, "id": 125 },
    { "type": "spike", "x": 65, "y": 9, "id": 126 },

    { "type": "block", "x": 68, "y": 9, "id": 127 },

    { "type": "spike", "x": 72, "y": 11, "id": 128 },
    { "type": "spike", "x": 73, "y": 11, "id": 129 },

    { "type": "portalMode", "x": 78, "y": 10, "id": 130, "properties": { "targetMode": "ship" } },

    { "type": "block", "x": 82, "y": 5, "id": 131 },
    { "type": "block", "x": 83, "y": 5, "id": 132 },
    { "type": "block", "x": 84, "y": 5, "id": 133 },
    { "type": "block", "x": 82, "y": 10, "id": 134 },
    { "type": "block", "x": 83, "y": 10, "id": 135 },
    { "type": "block", "x": 84, "y": 10, "id": 136 },

    { "type": "portalMode", "x": 88, "y": 10, "id": 137, "properties": { "targetMode": "ball" } },

    { "type": "block", "x": 90, "y": 4, "id": 138 },
    { "type": "block", "x": 91, "y": 4, "id": 139 },
    { "type": "block", "x": 92, "y": 4, "id": 140 },
    { "type": "block", "x": 93, "y": 4, "id": 141 },
    { "type": "block", "x": 94, "y": 4, "id": 142 },

    { "type": "portalMode", "x": 96, "y": 10, "id": 143, "properties": { "targetMode": "cube" } }
  ],
  "colors": []
}
